{
  "course_id": "coffee-live-main",
  "artifact_type": "content_package",
  "produced_by_step": "student_content",
  "schema_version": "0.2",
  "status": "approved",
  "revision": 0,
  "revision_note": null,
  "inputs": [
    "course_model",
    "blueprint",
    "course_outcomes"
  ],
  "updated_at": "2026-07-06T11:13:37+00:00",
  "body": {
    "asset_vocabulary": [
      "learning_objectives",
      "course_content",
      "summary",
      "case_study",
      "important_person",
      "did_you_know",
      "assessment",
      "activities",
      "resources"
    ],
    "subtopics": [
      {
        "subtopic_id": "m1_s1",
        "assets": [
          {
            "id": "m1_s1_cc",
            "type": "course_content",
            "title": "Core Concepts In Coffee Making",
            "format": "pptx",
            "content": "# Core Concepts In Coffee Making\n\n## Why These Concepts Matter\n\nEvery cup of coffee is the result of a chain of decisions that begins long before you reach for a mug. When you understand the core concepts behind coffee making, you can make better choices at every step, from the beans you buy to the way you brew them at home. This lesson introduces the essential vocabulary and the key decision points that new coffee makers need. Our goal is simple: help you connect what happens to a coffee bean with the practical choices you make in your own kitchen.\n\n## Coffee Starts on a Tree\n\nIt is easy to forget that coffee is an agricultural product. The coffee in your cup begins on a tree, and the story of that coffee moves through growing, harvesting, and roasting in coffee-growing regions across the world. This journey has been repeated for centuries. Understanding coffee as something that is grown, harvested, and roasted is the foundation for every later decision, because each stage shapes the flavor you eventually taste.\n\nOne useful way to think about the whole path is as a lifecycle that moves from seed to cup. Each phase in that lifecycle leaves its mark on the final drink. When you know that a bean has already traveled through many hands and processes before it reaches you, you can better appreciate why quality and freshness matter.\n\n## The Bean: Where Flavor Is Built\n\nThe coffee bean is the heart of the concept map. Beans are extracted, dried, roasted, and stored, and each of these steps plays a role in coffee's taste, texture, and level of caffeine. This means the bean is not just an ingredient; it is a record of everything that has happened to it.\n\nA few important bean-related concepts to know:\n\n- **Roast:** How the beans are roasted strongly influences flavor. Roasting is one of the biggest levers on taste.\n- **Decaf:** Decaffeinated coffee is an option for those who want the flavor with less caffeine.\n- **Organic coffee:** Coffee grown under organic practices is a distinct category shoppers can choose.\n- **Storage and shelf life:** How you store beans affects how long they stay fresh and how good your coffee tastes.\n\nA guiding principle links agriculture and preparation: the way coffee is harvested and processed plays a major role in how coffee should be roasted and brewed. In other words, the choices upstream constrain and inform the choices downstream. This is why experienced learners often recommend beginning your coffee education with the agriculture of coffee before moving on to grinding, brewing, and roasting.\n\n## Brewing: Turning Beans Into a Drink\n\nBrewing is the stage most learners are eager to master, because it is where the coffee actually gets made. Brewing is the process of learning how to turn beans into a finished cup and then refining that skill. It covers everything from grinding beans to cleaning equipment, along with the techniques and tips that make each method work well.\n\nThere are several popular brewing methods, and choosing among them is one of the most practical decisions a new coffee maker faces:\n\n- **Drip:** A convenient, automated method common in many homes.\n- **Pour-over:** A hands-on method that gives you control over the process.\n- **Espresso:** A concentrated method that also connects preparation directly to flavor profile.\n- **French press:** An immersion method known for a full-bodied cup.\n- **Cold brew:** A method that uses time rather than heat.\n\nEspresso is a helpful example of how the concepts connect. The espresso approach draws a direct link between preparation methods and flavor profile, showing that how you prepare coffee is inseparable from how it tastes. This is the same lesson that runs through the whole lifecycle, now expressed at the moment of brewing.\n\n## A Practical Decision You Can Make Today\n\nLet us connect these concepts to a real choice. Imagine you are buying beans and picking a way to make your morning coffee. Using the core concepts, you can reason through it:\n\n1. **Start with the bean.** Because roasting and storage shape flavor, choose a roast you enjoy and buy an amount you can use before it goes stale. Good storage protects the flavor you paid for.\n2. **Match your method to your goals.** If you want convenience, drip may fit. If you want control and are willing to be hands-on, pour-over is a strong choice. If you want a concentrated, intense cup, espresso links your preparation directly to a bold flavor profile.\n3. **Remember the chain.** Since how coffee is harvested and processed influences how it should be brewed, follow guidance that comes with quality beans rather than treating brewing as a step separate from everything before it.\n\nThis is the practical payoff of the core concepts: instead of guessing, you make each decision knowing how it fits into the larger seed-to-cup story.\n\n## Where to Learn More\n\nCoffee has a long tradition of education resources. Reliable consumer information covers origins, beans, brewing, health, and sustainability, and it is designed for the general public as well as students and professionals. Dedicated coffee education efforts have existed for decades, offering comprehensive coverage of brewing, roasting, espresso, agriculture, and coffee science. As you continue, you can deepen any of the concepts introduced here.\n\n## Key Takeaways\n\n- Coffee is an agricultural product that travels from seed to cup, and each stage shapes flavor.\n- The bean carries the effects of extraction, drying, roasting, and storage, which influence taste, texture, and caffeine.\n- How coffee is grown and processed influences how it should be roasted and brewed.\n- Choosing a brewing method such as drip, pour-over, espresso, French press, or cold brew is a core practical decision.\n- Preparation and flavor are linked, so your choices at each step add up to the cup in your hand.",
            "claims": [
              {
                "id": "cl1",
                "text": "The coffee in a cup begins on a tree, and coffee is grown, harvested, and roasted from coffee-growing regions across the world for centuries.",
                "source_id": "live_5",
                "support": "supported",
                "supporting_excerpt": "how the coffee in their cup begins on a tree! This section tells the flavorful origin story of coffee and how it\u2019s grown, harvested , and roasted from coffee-growing regions across the world for centuries.",
                "note": "Directly matches source text."
              },
              {
                "id": "cl2",
                "text": "The lifecycle of coffee was previously described as the 10 Steps from Seed to Cup.",
                "source_id": "live_5",
                "support": "supported",
                "supporting_excerpt": "Lifecycle of coffee (previously 10 Steps from Seed to Cup)",
                "note": "Source states lifecycle was previously the 10 Steps from Seed to Cup."
              },
              {
                "id": "cl3",
                "text": "Coffee beans are extracted, dried, roasted, and stored, and these play a role in coffee's taste, texture, and caffeination.",
                "source_id": "live_5",
                "support": "supported",
                "supporting_excerpt": "how coffee beans\u2014and how they are extracted, dried, roasted, and stored\u2014play a role in coffee\u2019s taste, texture, and caffeination",
                "note": "Matches source."
              },
              {
                "id": "cl4",
                "text": "Bean-related topics include roasts, decaf coffee, organic coffee, and storage and shelf life.",
                "source_id": "live_5",
                "support": "supported",
                "supporting_excerpt": "Roasts\nDecaf coffee\nOrganic coffee\nStorage and shelf life",
                "note": "Bean section lists these topics."
              },
              {
                "id": "cl5",
                "text": "Brewing information covers popular brewing methods along with techniques and tips for everything from grinding beans to cleaning equipment.",
                "source_id": "live_5",
                "support": "supported",
                "supporting_excerpt": "information on popular brewing methods as well as techniques and tips for everything from grinding beans to cleaning equipment",
                "note": "Matches source."
              },
              {
                "id": "cl6",
                "text": "Popular brewing methods include drip, pour-over, espresso, French press, and cold brew.",
                "source_id": "live_5",
                "support": "supported",
                "supporting_excerpt": "Drip\nPour-over\nEspresso\nFrench press\nCold brew",
                "note": "All five methods listed under Brewing."
              },
              {
                "id": "cl7",
                "text": "The NCA shifted most of its general About Coffee content to a new consumer website, AboutCoffee.org, developed as a resource for consumers, health professionals, journalists, students, and others.",